{
  "contractVersion": "flow-compass.quest-pack/0.1.0",
  "sourceVersion": "0.1.0",
  "locale": "ja-JP",
  "sessionSeconds": 300,
  "scientificStatus": {
    "scope": "身体・空間・関係・時間の前後差を扱う教育的自己観察",
    "metaphors": [
      "compass",
      "center-node",
      "torus",
      "hourglass",
      "lotus-receptacle"
    ],
    "claimPolicy": "比喩を解剖学・神経科学・物理学上の事実として主張しない"
  },
  "quests": [
    {
      "id": "flow-compass:01:moving-center",
      "day": 1,
      "slug": "moving-center",
      "phase": "NOTICE",
      "title": "中心は動いてよい",
      "status": "test-ready",
      "durationSeconds": 300,
      "prompt": "中心は見つけるものではなく、今の操作でどこへ動いた？",
      "intention": "注意が集まる場所を仮のnodeとして置き、操作前後の移動を発見する。",
      "steps": [
        {
          "startSecond": 0,
          "durationSeconds": 30,
          "label": "ARRIVE",
          "instruction": "目を開けたまま座るか立つ。足または椅子の接触を一か所確認し、痛みがない姿勢を選ぶ。"
        },
        {
          "startSecond": 30,
          "durationSeconds": 45,
          "label": "LOCATE",
          "instruction": "『今、注意が最も集まる場所は？』と問い、眉間・胸・腹・足・身体の外・不明から仮に一つ選ぶ。正解にしない。"
        },
        {
          "startSecond": 75,
          "durationSeconds": 90,
          "label": "EXPERIMENT",
          "instruction": "指を眉間から20cm離して置き、触れずに10秒見る。次に指を胸の前、腹の前へゆっくり移す。各位置で注意の凝縮・広がり・変化なしを比べる。"
        },
        {
          "startSecond": 165,
          "durationSeconds": 75,
          "label": "REORIENT",
          "instruction": "指を下ろし、視線を部屋の遠い一点へ移す。最初の中心候補が動いたか、境界が変わったかを確認し、楽な方向へ一歩または重心を1cm動かす。"
        },
        {
          "startSecond": 240,
          "durationSeconds": 60,
          "label": "RECORD",
          "instruction": "観察『注意はAからBへ』、解釈『私は〜かもしれない』、次の一歩『今日の○○前に10秒再確認』を各一行で記録する。"
        }
      ],
      "bodyCue": "額を固めず、足か椅子の接触を保ったまま視線と注意の位置差を見る。",
      "microExperiment": "指の位置を眉間・胸・腹の前へ動かし、触れずに注意の集まり方を比較する。",
      "reflection": [
        "直接感じた位置・圧・広がりは何だった？",
        "そこへ付けた意味は何だった？"
      ],
      "record": {
        "observation": "操作前後の中心候補と境界",
        "interpretation": "感覚に付けた意味（仮説）",
        "nextAction": "今日10秒で再試行する場面",
        "deltaScale": [
          -2,
          -1,
          0,
          1,
          2
        ]
      },
      "progressionLink": "Day 2では中心だけでなく、身体と床の接触地図を現在地に加える。",
      "safetyCue": "目は開けたままでよい。頭痛やめまいがあれば指の追視を止め、固定物を見る。"
    },
    {
      "id": "flow-compass:02:contact-map",
      "day": 2,
      "slug": "contact-map",
      "phase": "NOTICE",
      "title": "接触から現在地を描く",
      "status": "test-ready",
      "durationSeconds": 300,
      "prompt": "身体の現在地を、気分ではなく三つの接触点で表すと？",
      "intention": "頭の中の説明より先に、床・椅子・衣服との接触圧を地図として採取する。",
      "steps": [
        {
          "startSecond": 0,
          "durationSeconds": 30,
          "label": "ARRIVE",
          "instruction": "座位か立位で、目に入る四角い物を一つ言う。足裏または座面の接触を確認する。"
        },
        {
          "startSecond": 30,
          "durationSeconds": 45,
          "label": "LOCATE",
          "instruction": "接触点を3つ探し、強い・中・弱の印を心の中で付ける。左右均等にしようとしない。"
        },
        {
          "startSecond": 75,
          "durationSeconds": 90,
          "label": "EXPERIMENT",
          "instruction": "重心を前・中央・後へ各2cmだけ移す。毎回止まり、強くなる接触点と消える接触点を一つずつ採取する。"
        },
        {
          "startSecond": 165,
          "durationSeconds": 75,
          "label": "REORIENT",
          "instruction": "最も動きやすかった位置から、机上の物へ片手を伸ばして戻す。接触地図が動作の前後でどう変わるかを見る。"
        },
        {
          "startSecond": 240,
          "durationSeconds": 60,
          "label": "RECORD",
          "instruction": "操作前後の強い接触点、動きやすい方向、次に試す日常動作を各一行で記録する。"
        }
      ],
      "bodyCue": "膝を固めず、重心移動は倒れない2cm以内。接触が薄い場所もデータにする。",
      "microExperiment": "重心を前・中央・後へ2cm移し、接触圧の地図を書き換える。",
      "reflection": [
        "強い接触点はどこからどこへ移った？",
        "『安定／不安定』という評価を外すと何が残る？"
      ],
      "record": {
        "observation": "三つの接触点と圧の変化",
        "interpretation": "安定・不安定などの評価",
        "nextAction": "接触地図を使う日常動作",
        "deltaScale": [
          -2,
          -1,
          0,
          1,
          2
        ]
      },
      "progressionLink": "Day 3では接触地図に前後・左右・上下の向きを重ねる。",
      "safetyCue": "転倒リスクがあれば座位で行い、可動域を小さくする。"
    },
    {
      "id": "flow-compass:03:six-directions",
      "day": 3,
      "slug": "six-directions",
      "phase": "NOTICE",
      "title": "六方向に余白をつくる",
      "status": "test-ready",
      "durationSeconds": 300,
      "prompt": "『上が良い、前が正しい』を外したとき、今アクセスしやすい方向は？",
      "intention": "前後左右上下に優劣を置かず、今使いやすい方向と使いにくい方向を観察する。",
      "steps": [
        {
          "startSecond": 0,
          "durationSeconds": 30,
          "label": "ARRIVE",
          "instruction": "接触点を一つ選び、そこを基準に現在の正面を指で示す。"
        },
        {
          "startSecond": 30,
          "durationSeconds": 45,
          "label": "LOCATE",
          "instruction": "前・後・右・左・上・下を視線または指で小さく示し、最も近く感じる方向を一つ選ぶ。"
        },
        {
          "startSecond": 75,
          "durationSeconds": 90,
          "label": "EXPERIMENT",
          "instruction": "六方向へ順に1cm伸びて中央へ戻る。動きの大きさでなく、開始の速さ・息・接触圧のどれが変わるか比べる。"
        },
        {
          "startSecond": 165,
          "durationSeconds": 75,
          "label": "REORIENT",
          "instruction": "使いにくかった方向へ目だけ向け、次に頭、最後に胴を少し追従させる。最初と同じ方向が近いか確認する。"
        },
        {
          "startSecond": 240,
          "durationSeconds": 60,
          "label": "RECORD",
          "instruction": "近い方向、遠い方向、順序を変えた後の差、今日使う一方向を記録する。"
        }
      ],
      "bodyCue": "軸を真っすぐに矯正せず、接触点から各方向への小さな余白を探す。",
      "microExperiment": "六方向へ1cm動き、視線→頭→胴の順序で遠い方向への経路を変える。",
      "reflection": [
        "動きやすさは方向と順序のどちらで変わった？",
        "方向へ付けていた良い／悪いは何？"
      ],
      "record": {
        "observation": "近い方向・遠い方向・前後差",
        "interpretation": "方向に付けた価値",
        "nextAction": "今日意図的に使う方向",
        "deltaScale": [
          -2,
          -1,
          0,
          1,
          2
        ]
      },
      "progressionLink": "Day 4では方向を狭める／広げる操作と組み合わせる。",
      "safetyCue": "首や腰に痛みがある方向は視線だけにし、痛みを越えない。"
    },
    {
      "id": "flow-compass:04:compress-release",
      "day": 4,
      "slug": "compress-release",
      "phase": "NOTICE",
      "title": "凝縮と解放を比較する",
      "status": "test-ready",
      "durationSeconds": 300,
      "prompt": "今必要なのは広がること、それとも一度まとまること？",
      "intention": "凝縮を悪、解放を善とせず、両方が注意と行動に与える差を採取する。",
      "steps": [
        {
          "startSecond": 0,
          "durationSeconds": 30,
          "label": "ARRIVE",
          "instruction": "息を止めず、両手を腿か机に置く。現在の視野の広さを一語で仮記録する。"
        },
        {
          "startSecond": 30,
          "durationSeconds": 45,
          "label": "LOCATE",
          "instruction": "親指と人差し指を1cm離し、その隙間へ10秒注意を集める。身体のどこが同時に固まるか探す。"
        },
        {
          "startSecond": 75,
          "durationSeconds": 90,
          "label": "EXPERIMENT",
          "instruction": "指の隙間をゆっくり閉じて凝縮、次に手を肩幅へ開いて解放する。3往復し、視野・接触圧・動き出しの差を一つ選ぶ。"
        },
        {
          "startSecond": 165,
          "durationSeconds": 75,
          "label": "REORIENT",
          "instruction": "凝縮してから一点を見る場合と、解放してから周囲を見る場合に、机上の物へ手を伸ばす速さを比べる。"
        },
        {
          "startSecond": 240,
          "durationSeconds": 60,
          "label": "RECORD",
          "instruction": "凝縮が役立った点、解放が役立った点、切り替えたい場面を各一行で記録する。"
        }
      ],
      "bodyCue": "握力は2割まで。顎・肩・呼吸が固まったら力を半分にする。",
      "microExperiment": "1cmの指の隙間と肩幅の手を往復し、凝縮／解放後の動作を比べる。",
      "reflection": [
        "凝縮と解放で何が一つ変わった？",
        "どちらを善悪で見ていた？"
      ],
      "record": {
        "observation": "視野・接触・動き出しの差",
        "interpretation": "凝縮／解放への価値判断",
        "nextAction": "切り替えを試す場面",
        "deltaScale": [
          -2,
          -1,
          0,
          1,
          2
        ]
      },
      "progressionLink": "Day 5では凝縮点を固定せず、位置が変わる境界として探る。",
      "safetyCue": "息を止めず、手や肩に痛みがあれば想像上の開閉だけで行う。"
    },
    {
      "id": "flow-compass:05:hourglass-boundary",
      "day": 5,
      "slug": "hourglass-boundary",
      "phase": "NOTICE",
      "title": "境界の細いところ",
      "status": "test-ready",
      "durationSeconds": 300,
      "prompt": "すべてを通すのでなく、一つを選び次へ渡す境界は今どこ？",
      "intention": "砂時計の細部を比喩に、入力が選ばれ出力へ変わる一時的な結節点を探す。",
      "steps": [
        {
          "startSecond": 0,
          "durationSeconds": 30,
          "label": "ARRIVE",
          "instruction": "周囲の音を三つ受け取り、足または座面の接触へ戻る。"
        },
        {
          "startSecond": 30,
          "durationSeconds": 45,
          "label": "LOCATE",
          "instruction": "両手で上下に離れた二つの空間を示し、その間の細い境目を身体の前に仮置きする。上下は途中で入れ替えてよい。"
        },
        {
          "startSecond": 75,
          "durationSeconds": 90,
          "label": "EXPERIMENT",
          "instruction": "周囲の音から一つを選び、細い境目へ集めるように手を近づけ、別の方向へ手を開く。音→選択→動作を3回、選ぶ音を変えて行う。"
        },
        {
          "startSecond": 165,
          "durationSeconds": 75,
          "label": "REORIENT",
          "instruction": "砂時計を横・斜めに回すように手の向きを変える。結節点が身体の内外どこへ移る感じか、または変化なしを確認する。"
        },
        {
          "startSecond": 240,
          "durationSeconds": 60,
          "label": "RECORD",
          "instruction": "入ったもの、選んだもの、出した動作、結節点の位置を短語で記録する。"
        }
      ],
      "bodyCue": "首や胸を絞らず、細さは手の間の空間として表す。上下を固定しない。",
      "microExperiment": "一つの音を選び、手で凝縮点を作って別方向の小動作へ渡す。",
      "reflection": [
        "何を入力として選び、何を通さなかった？",
        "結節点は操作でどこへ変わった？"
      ],
      "record": {
        "observation": "入力・選択・出力と結節点",
        "interpretation": "通した／止めた意味",
        "nextAction": "一入力を一動作へ渡す場面",
        "deltaScale": [
          -2,
          -1,
          0,
          1,
          2
        ]
      },
      "progressionLink": "Day 6では結節点を花托として、受け取る／支える／分岐する機能に広げる。",
      "safetyCue": "音に過敏さがあれば視覚対象を入力に替える。身体の部位を締めない。"
    },
    {
      "id": "flow-compass:06:receptacle-choice",
      "day": 6,
      "slug": "receptacle-choice",
      "phase": "NOTICE",
      "title": "花托は受けて選ぶ",
      "status": "test-ready",
      "durationSeconds": 300,
      "prompt": "開くか閉じるかではなく、何を受け、何を支え、どこへ渡す？",
      "intention": "lotus/receptacleを開放の象徴だけでなく、受け取り・支え・方向選択の比喩として使う。",
      "steps": [
        {
          "startSecond": 0,